{
  "schema_version": "3.0",
  "document": "Runbook-Register",
  "as_of": "2026-09-24",
  "rule": "Jedes Szenario aus §7.9, jeder Killer-Test aus §8.3, jedes HA-Ereignis aus §10.5 und jeder Sperrgrund aus SM-SAFETY hat mindestens ein Runbook.",
  "runbooks": [
    {
      "id": "RB-01",
      "title": "Geldpfad-Instanz ausgefallen oder startet nicht",
      "severity": "KRITISCH",
      "triggers": "Heartbeat fehlt länger als P-OPS-HEARTBEAT-CRIT-S; Neustartgrenze erreicht",
      "scenarios": [],
      "killer_tests": [],
      "ha_events": [
        "HA-VPS-DOWN",
        "HA-RESTART-LIMIT"
      ],
      "safety_reasons": [
        "BOOT",
        "SYNC_REQUIRED",
        "GUARDIAN_LEASE_EXPIRED"
      ],
      "steps": [
        "Externer Monitor alarmiert über beide Kanäle; offene Positionen sind durch Stopps beim Broker geschützt.",
        "Betreiber prüft im Broker-Webterminal oder mobilen MT5-Zugang Positionen und Stopps (nur lesend, keine Eingriffe ohne RB-23).",
        "Neustart der Instanz; der Kern startet in BOOTING, dann SYNCING mit Vollabgleich.",
        "Scheitert der Neustart binnen P-OPS-RTO-CORE-H: Restore auf Ersatzinstanz nach RB-16 mit Fencing nach RB-17.",
        "Incident mit Zeitlinie und Ursache; Post-Mortem nach operations/operations_plan.md."
      ],
      "exit_criteria": "Kern in READY oder ENTRY_PAUSED mit konsistentem Snapshot; Incident geschlossen.",
      "drills": [
        "DR-01",
        "DR-02"
      ],
      "owner": "Betreiber (B)",
      "system_first": true
    },
    {
      "id": "RB-02",
      "title": "MT5-Terminal oder Brokersitzung getrennt",
      "severity": "HOCH",
      "triggers": "Adapter meldet IPC- oder Sitzungsfehler; Abfragen scheitern",
      "scenarios": [],
      "killer_tests": [
        "KT-12"
      ],
      "ha_events": [
        "HA-SESSION-LOST"
      ],
      "safety_reasons": [
        "BROKER_SESSION_DOWN",
        "SNAPSHOT_STALE"
      ],
      "steps": [
        "Einstiegssperre (BROKER_SESSION_DOWN); Schutz liegt beim Broker.",
        "Terminal-Neustart durch den Guardian; Anmeldung prüfen.",
        "Nach Wiederverbindung Deals seit dem Cursor nachziehen (KT-12) und Vollabgleich.",
        "Offene Versuche ohne Antwort als UNKNOWN nach RB-05 klären."
      ],
      "exit_criteria": "Sitzung fünf Minuten stabil, Abgleich konsistent.",
      "drills": [
        "DR-10"
      ],
      "owner": "Betreiber (B)",
      "system_first": true
    },
    {
      "id": "RB-03",
      "title": "Schutzstopp fehlt oder ist unbestätigt",
      "severity": "KRITISCH",
      "triggers": "Position ohne bestätigten SL nach P-EXE-STOP-CONFIRM-S",
      "scenarios": [],
      "killer_tests": [
        "KT-06",
        "KT-07"
      ],
      "ha_events": [],
      "safety_reasons": [
        "STOP_MISSING"
      ],
      "steps": [
        "Genau ein Schutzversuch je Brokerrevision (SL setzen oder anpassen).",
        "Scheitert er: Position über `position=Ticket` schließen.",
        "Sperrgrund STOP_MISSING bis zur Quittung des Betreibers; Incident."
      ],
      "exit_criteria": "Jede offene Position hat einen bestätigten SL über die volle Menge.",
      "drills": [
        "DR-10"
      ],
      "owner": "Betreiber (B)",
      "system_first": true
    },
    {
      "id": "RB-04",
      "title": "Journal nicht beschreibbar",
      "severity": "KRITISCH",
      "triggers": "Schreibfehler oder fsync-Fehler im Journal",
      "scenarios": [],
      "killer_tests": [],
      "ha_events": [
        "HA-JOURNAL"
      ],
      "safety_reasons": [
        "JOURNAL_WRITE_FAILURE"
      ],
      "steps": [
        "Kein Senden neuer Orders; Wechsel auf das Notfalljournal.",
        "Nur Schutzaktionen mit Snapshot jünger als P-EXE-SNAPSHOT-MAX-S.",
        "Scheitert auch das Notfalljournal: Fail-Stop; Neustart in BOOTING mit Integritätsprüfung.",
        "Nach Wiederherstellung Notfallaktionen rekonstruieren und kennzeichnen."
      ],
      "exit_criteria": "Journal beschreibbar, Integritätsprüfung bestanden, Betreiberfreigabe.",
      "drills": [
        "DR-02"
      ],
      "owner": "Betreiber (B)",
      "system_first": true
    },
    {
      "id": "RB-05",
      "title": "UNKNOWN-Klärung",
      "severity": "HOCH",
      "triggers": "Sendeversuch ohne eindeutige Antwort (Zeitüberschreitung, IPC-Fehler)",
      "scenarios": [],
      "killer_tests": [
        "KT-04",
        "KT-05"
      ],
      "ha_events": [],
      "safety_reasons": [
        "UNKNOWN_ORDER"
      ],
      "steps": [
        "Reservierung und Einstiegssperre des Instruments bleiben.",
        "Abfragen nach P-EXE-UNKNOWN-POLL-S, danach im Intervall P-EXE-UNKNOWN-POLL-LATER-S.",
        "Negativnachweis nur nach Ablauf der Gültigkeit und P-EXE-NEGPROOF-CYCLES sauberen Abfragezyklen.",
        "Nach P-EXE-UNKNOWN-MAX-H Eskalation an den Betreiber; nie erneut senden."
      ],
      "exit_criteria": "Alle UNKNOWN geklärt (FILLED, CANCELLED, EXPIRED oder NOT_EXECUTED_PROVEN).",
      "drills": [
        "DR-10"
      ],
      "owner": "Betreiber (B)",
      "system_first": true
    },
    {
      "id": "RB-06",
      "title": "Fremde Position, fremde Order oder Stornierung durch die Börse",
      "severity": "HOCH",
      "triggers": "Abgleich findet unbekannte Bestände oder stornierte Deals",
      "scenarios": [
        "SC-H-2022NI"
      ],
      "killer_tests": [],
      "ha_events": [],
      "safety_reasons": [
        "FOREIGN_POSITION"
      ],
      "steps": [
        "Sperrgrund FOREIGN_POSITION; das System schließt nie still.",
        "Betreiber prüft Herkunft (eigener Eingriff, Broker, Börsenstornierung).",
        "Stornierte Deals der Börse als Korrektur verbuchen; P&L und Risiko neu.",
        "Freigabe nur mit signierter Quittung."
      ],
      "exit_criteria": "Bestände erklärt und abgeglichen.",
      "drills": [],
      "owner": "Betreiber (B)",
      "system_first": true
    },
    {
      "id": "RB-07",
      "title": "Tagesverlust-Leiter ausgelöst oder Tagesgrenze erreicht",
      "severity": "HOCH",
      "triggers": "Tagesverlust erreicht P-RISK-DL-L1, P-RISK-DL-L2, P-RISK-DL-L3 oder P-OP-DAILY-LOSS-CAP",
      "scenarios": [
        "SC-X-GAP5",
        "SC-X-GAP10"
      ],
      "killer_tests": [],
      "ha_events": [],
      "safety_reasons": [
        "DAILY_LOSS_PAUSE",
        "DAILY_LOSS_EXIT",
        "DAILY_LOSS_CAP_BREACH"
      ],
      "steps": [
        "L1: Risikoziel halbieren (automatisch).",
        "L2: Einstiegssperre (automatisch); Betreiber informiert.",
        "L3: geordneter Abbau über Child-Orders (automatisch).",
        "Grenze erreicht: schwerer Incident, Ursachenbericht, neuer Grant nötig (RK-29)."
      ],
      "exit_criteria": "Nächster Handelstag oder signierte Wiederaufnahme nach Ursachenbericht.",
      "drills": [
        "DR-05"
      ],
      "owner": "Betreiber (B)",
      "system_first": true
    },
    {
      "id": "RB-08",
      "title": "Drawdown-Leiter und Wochenverlust",
      "severity": "HOCH",
      "triggers": "Drawdown vom Höchststand oder Wochenverlust über Schwelle",
      "scenarios": [],
      "killer_tests": [],
      "ha_events": [],
      "safety_reasons": [
        "DRAWDOWN_REVIEW",
        "DRAWDOWN_EXIT",
        "WEEKLY_LOSS_PAUSE"
      ],
      "steps": [
        "Stufe je P-RISK-DD-L1 bis P-RISK-DD-KILL anwenden (automatisch).",
        "Profilabstieg nach §7.8 (automatisch).",
        "Ab Stufe 3 Betreiberprüfung; ab Stopp neuer Grant."
      ],
      "exit_criteria": "Signierte Entscheidung des Betreibers; bei Stopp neuer Grant.",
      "drills": [],
      "owner": "Betreiber (B)",
      "system_first": true
    },
    {
      "id": "RB-09",
      "title": "Alarmkanal ausgefallen",
      "severity": "MITTEL",
      "triggers": "Testalarm nicht quittiert oder Kanal länger als P-OPS-ALERT-DOWN-H gestört",
      "scenarios": [],
      "killer_tests": [],
      "ha_events": [
        "HA-ALERT"
      ],
      "safety_reasons": [
        "ALERT_CHANNEL_DOWN"
      ],
      "steps": [
        "Zweiten Kanal prüfen; Einstiegssperre nach P-OPS-ALERT-DOWN-H, sofort wenn beide ausfallen.",
        "Kanal reparieren, Testalarm quittieren."
      ],
      "exit_criteria": "Beide Kanäle quittiert.",
      "drills": [
        "DR-08"
      ],
      "owner": "Betreiber (B)",
      "system_first": true
    },
    {
      "id": "RB-10",
      "title": "Uhrabweichung oder Plattenbelegung",
      "severity": "MITTEL",
      "triggers": "Uhr über P-OPS-CLOCK-WARN-S oder Platte über den Stufen P-OPS-DISK-LEVELS",
      "scenarios": [],
      "killer_tests": [],
      "ha_events": [
        "HA-CLOCK",
        "HA-DISK"
      ],
      "safety_reasons": [
        "CLOCK_DRIFT",
        "DISK_HIGH"
      ],
      "steps": [
        "Warnung; ab P-OPS-CLOCK-BLOCK-S bzw. oberster Plattenstufe Einstiegssperre.",
        "NTP prüfen, Platz schaffen (Nebenaufgaben stoppen, alte Sicherungen verschieben)."
      ],
      "exit_criteria": "Werte fünf Minuten im Normalbereich.",
      "drills": [],
      "owner": "Betreiber (B)",
      "system_first": true
    },
    {
      "id": "RB-11",
      "title": "KI-Zone oder Evaluator ausgefallen, KI-Kontingent erschöpft",
      "severity": "NIEDRIG",
      "triggers": "Heartbeat der KI- oder Prüfinstanz fehlt; Abo-Kontingent verbraucht",
      "scenarios": [],
      "killer_tests": [],
      "ha_events": [
        "HA-AI-DOWN",
        "HA-EVALUATOR-DOWN"
      ],
      "safety_reasons": [
        "AUDIT_NOT_RUN"
      ],
      "steps": [
        "Geldpfad unberührt; ohne Evaluator keine neuen Torergebnisse und keine Einstiege, wenn die tägliche Prüfung ausfällt (AUDIT_NOT_RUN).",
        "KI-Aufgaben pausieren (SM-HERMES PAUSED_BUDGET oder OFFLINE); System läuft in Stufe H0."
      ],
      "exit_criteria": "Instanzen wieder verfügbar; Prüfung nachgeholt.",
      "drills": [],
      "owner": "Betreiber (B)",
      "system_first": true
    },
    {